word,definition
"come in for","to be subject to or the object of"
"call it quits","to stop doing what one is doing"
"down the stairs","on a floor below"
"day by day","gradually and progressively"
"day after day","for an indefinite number of successive days"
"dead on target","accurately placed or thrown"
"dressed to kill","dressed in fancy or formal clothing"
"deep in thought","deeply absorbed in thought"
"double leg circle","a gymnastic exercise performed on the pommel horse when the gymnast (with legs together) swings his legs in a circle while alternating hands on the pommels"
"ducks and drakes","a game in which a flat stone is bounced along the surface of calm water"
"danse du ventre","a Middle Eastern dance in which the dancer makes sensuous movements of the hips and abdomen"
"dance of death","a medieval dance in which a skeleton representing death leads a procession of others to the grave"
"dilation and curettage","a surgical procedure usually performed under local anesthesia in which the cervix is dilated and the endometrial lining of the uterus is scraped with a curet"
"dilatation and curettage","a surgical procedure usually performed under local anesthesia in which the cervix is dilated and the endometrial lining of the uterus is scraped with a curet"
"differential blood count","counting the number of specific types of white blood cells found in 1 cubic millimeter of blood"
"dark ground illumination","a form of microscopic examination of living material by scattered light"
"dark field illumination","a form of microscopic examination of living material by scattered light"
"digital communications technology","the design and construction of communications technology that transmits information in digital form"
"deep supporting fire","fire on objectives not in the immediate vicinity of your forces but with the objective of destroying enemy reserves and weapons and interfering with the enemy command and supply and communications"
"direct supporting fire","fire delivered in support of part of a force (as opposed to general supporting fire delivered in support of the force as a whole)"
"dolce far niente","carefree idleness"
"dissolution of marriage","an annulment of a marriage"
"darkling groung beetle","sluggish hard-bodied black terrestrial weevil whose larvae feed on e.g. decaying plant material or grain"
"devil's darning needle","slender-bodied non-stinging insect having iridescent wings that are outspread at rest"
"devil's darning needle","common climber of eastern North America that sprawls over other plants and bears numerous panicles of small creamy white flowers"
"domestic silkworm moth","stocky creamy-white Asiatic moth found almost entirely under human care"
"domesticated silkworm moth","stocky creamy-white Asiatic moth found almost entirely under human care"
"dusky-footed wood rat","a wood rat with dusky feet"
"daisy print wheel","a wheel around which is a set of print characters that make a typing impression on paper"
"dedicated file server","(computer science) a file server that can be used only as a file server"
"data input device","a device that can be used to insert data into a computer or other computational device"
"day care center","a nursery for the supervision of preschool children while the parents work"
"digital subscriber line","a generic name for digital lines that are provided by telephone companies to their local subscribers and that carry data at high speeds"
"dot matrix printer","a printer that represents each character as a pattern of dots from a dot matrix"
"drive line system","mechanism that transmits power from the engine to the driving wheels of a motor vehicle"
"drug of abuse","a drug that is taken for nonmedicinal reasons (usually for mind-altering effects)"
"dual scan display","a type of passive matrix display in which the top and bottom half of the screen are refreshed simultaneously"
"deep cervical vein","a vein that accompanies an artery of the same name"
"dorsal scapular vein","vein that is a tributary of the subclavian vein or external jugular vein and accompanies the descending scapular artery"
"deep temporal vein","temporal veins that empty into the pterygoid plexus"
"desire to know","curiosity that motivates investigation and study"
"degree of freedom","(statistics) an unrestricted variable in a frequency distribution"
"degree of freedom","one of the minimum number of parameters needed to describe the state of a physical system"
"doctrine of analogy","the religious belief that between creature and creator no similarity can be found so great but that the dissimilarity is always greater"
"distribution free statistic","a statistic computed without knowledge of the form or the parameters of the distribution from which observations are drawn"
"doubly transitive verb","a transitive verb that takes both a direct and an indirect object"
"disk operating system","an operating system that is on a disk"
"deed of conveyance","a legal document signed and sealed and delivered to effect a transfer of property and to show the legal right to possess it"
"deed of trust","a written instrument legally conveying property to a trustee often used to secure an obligation such as a mortgage or promissory note"
"database management system","a software system that facilitates the creation and maintenance and use of an electronic database"
"decimal numeration system","a positional system of numeration that uses decimal digits and a base of ten"
"decimal number system","a positional system of numeration that uses decimal digits and a base of ten"
"duodecimal number system","a positional system of numeration that uses duodecimal digits and a radix of twelve"
"difference of opinion","a disagreement or argument about something important"
"demand for explanation","a challenge to defend what someone has said"
"demand for identification","as by a sentry"
"day of reckoning","an unpleasant or disastrous destiny"
"devil's food cake","very dark chocolate cake"
"deck of cards","a pack of 52 playing cards"
"dot com company","a company that operates its business primarily on the internet using a URL that ends in `.com'"
"department of anthropology","the academic department responsible for teaching and research in anthropology"
"department of biology","the academic department responsible for teaching and research in biology"
"department of linguistics","the academic department responsible for teaching and research in linguistics"
"department of mathematics","the academic department responsible for teaching and research in mathematics"
"department of corrections","the department of local government that is responsible for managing the treatment of convicted offenders"
"domestic relations court","a court in some states in the United States that has jurisdiction over family disputes (especially those involving children)"
"de facto segregation","segregation (especially in schools) that happens in fact although not required by law"
"de jure segregation","segregation that is imposed by law"
"depository financial institution","a financial institution that accepts deposits and channels the money into lending activities"
"dirty old man","a middle-aged man with lecherous inclinations"
"deus ex machina","any active agent who appears unexpectedly to solve an insoluble difficulty"
"director of research","a supervisor in a research center"
"direct electric current","an electric current that flows in one direction steadily"
"dilleniid dicot family","family of more or less advanced dicotyledonous trees and shrubs and herbs"
"dilleniid dicot genus","genus of more or less advanced dicotyledonous trees and shrubs and herbs"
"devil's walking stick","small deciduous clump-forming tree or shrub of eastern United States"
"desert four o'clock","wildflower having vibrant deep pink tubular evening-blooming flowers"
"desert sand verbena","soft-haired sticky plant with heads of bright pink trumpet-shaped flowers"
"dense blazing star","perennial of southeastern and central United States having very dense spikes of purple flowers"
"dancing lady orchid","any orchid of the genus Oncidium: characterized by slender branching sprays of small yellow and brown flowers"
"downy yellow violet","violet of eastern North America having softly pubescent leaves and stems and clear yellow flowers with brown-purple veins"
"desert mariposa tulip","mariposa with clusters of bell-shaped vermilion or orange or yellow flowers atop short stems"
"damson plum tree","plum tree long cultivated for its edible fruit"
"dove's foot geranium","western geranium with small pink flowers"
"downy wood mint","a variety of wood mint"
"dittany of crete","dwarf aromatic shrub of Crete"
"downy ground cherry","decorative American annual having round fleshy yellow berries enclosed in a bladderlike husk"
"daisyleaf grape fern","of North America and Eurasia"
"daisy-leaved grape fern","of North America and Eurasia"
"damping off fungus","fungus causing damping off disease in seedlings"
"decline in quality","process of changing to an inferior state"
"distributed data processing","data processing in which some of the functions are performed in different places and connected by transmission facilities"
"double decomposition reaction","a chemical reaction between two compounds in which parts of each are interchanged to form two new compounds (AB+CD=AD+CB)"
"double replacement reaction","a chemical reaction between two compounds where the positive ion of one compound is exchanged with the positive ion of another compound"
"dry plate process","a former photographic method that used a glass plate coated with a light-sensitive gelatinous emulsion"
"deviated nasal septum","abnormal shift in location of the nasal septum"
"disseminated multiple sclerosis","a chronic progressive nervous disorder involving loss of myelin sheath around certain nerve fibers"
"degenerative joint disease","chronic breakdown of cartilage in the joints"
"distal muscular dystrophy","a form of muscular dystrophy that sets in between 40 and 60 years of age and is characterized by weakness and wasting of the muscles of the hands and forearms and lower legs"
"disseminated lupus erythematosus","an inflammatory disease of connective tissue with variable features including fever and weakness and fatigability and joint pains and skin lesions on the face or neck or arms"
"deer fly fever","a highly infectious disease of rodents (especially rabbits and squirrels) and sometimes transmitted to humans by ticks or flies or by handling infected animals"
"delusions of grandeur","a delusion (common in paranoia) that you are much greater and more powerful and influential than you really are"
"delusions of persecution","a delusion (common in paranoia) that others are out to get you and frustrate and embarrass you or inflict suffering on you"
"disorganized type schizophrenia","a form of schizophrenia characterized by severe disintegration of personality including erratic speech and childish mannerisms and bizarre behavior"
"defect of speech","a disorder of oral speech"
"disability of walking","a disability that interferes with or prevents walking"
"day of rest","a day set aside for rest"
"day of remembrance","the date on which an event occurred in some previous year (or the celebration of it)"
"diamond wedding anniversary","the 60th wedding anniversary"
"date of reference","(astronomy) an arbitrarily fixed date that is the point in time relative to which information (as coordinates of a celestial body) is recorded"
"drop like flies","rapidly collapse, die, or drop out in large numbers"
"draw the line","reasonably object (to) or set a limit (on)"
"draw a line","reasonably object (to) or set a limit (on)"
"do away with","terminate, end, or take out"
"draw a blank","be unable to remember"
"drop a line","communicate (with) in writing"
"dish the dirt","wag one's tongue"
"drain the cup","drink to the last drop"
"drop one's serve","lose a game in which one is serving"
"drag a bunt","hit a ball in such a way so as to make it go a short distance"
"do the dishes","wash dishes"
"draw and quarter","pull (a person) apart with four horses tied to his extremities, so as to execute him"
"do well by","treat with respect and consideration"
"do the honors","act as the host and receive or introduce one's guests"
"deliver the goods","attain success or reach a desired goal"
"do one's best","perform a task as well as possible"
"drop the ball","commit a faux pas or a fault or make a serious mistake"
"drag one's feet","postpone doing what one should be doing"
"drag one's heels","postpone doing what one should be doing"
"every which way","in a random manner"
"every which way","haphazardly"
"even a little","to any extent at all"
"every so often","occasionally"
"ex post facto","affecting things past"
"economy of scale","the saving in cost of production that is due to mass production"
"embryonic stem-cell research","biological research on stem cells derived from embryos and on their use in medicine"
"electromotive drug administration","therapy that uses a local electric current to introduce the ions of a medicine into the tissues"
"electron spin resonance","microwave spectroscopy in which there is resonant absorption of radiation by a paramagnet"
"electron paramagnetic resonance","microwave spectroscopy in which there is resonant absorption of radiation by a paramagnet"
"enzyme-linked-immunosorbent serologic assay","an assay that relies on an enzymatic conversion reaction and is used to detect the presence of specific substances (such as enzymes or viruses or antibodies or bacteria)"
"electronic warfare-support measures","electronic warfare undertaken under direct control of an operational commander to locate sources of radiated electromagnetic energy for the purpose of immediate threat recognition"
"electronic manipulative deception","actions to eliminate revealing telltale indicators that could be used by the enemy (or to convey misleading indicators)"
"electronic simulative deception","actions to represent friendly notional or actual capabilities to mislead hostile forces"
"electronic imitative deception","the introduction of electromagnetic energy into enemy systems that imitates enemy emissions"
"eastern red-backed salamander","common salamander of eastern North America"
"eastern cricket frog","a cricket frog of eastern United States"
"eastern narrow-mouthed toad","small toad of southeastern United States"
"eastern fence lizard","small active lizard of United States and north to British Columbia"
"eastern ground snake","in some classifications placed in genus Haldea"
"eastern coral snake","ranges from Central America to southeastern United States"
"eastern indigo snake","a variety of indigo snake"
"edible sea urchin","a sea urchin that can be eaten"
"eastern grey squirrel","common medium-large squirrel of eastern North America"
"eastern gray squirrel","common medium-large squirrel of eastern North America"
"eastern fox squirrel","exceptionally large arboreal squirrel of eastern United States"
"eastern lowland gorilla","a kind of gorilla"
"electronic bulletin board","a computer that is running software that allows users to leave messages and access information of general interest"
"eau de cologne","a perfumed liquid made of essential oils and alcohol"
"engine cooling system","equipment in a motor vehicle that cools the engine"
"electric frying pan","a frying pan heated by electricity"
"early warning radar","a radar that is part of an early warning system"
"early warning system","a network of radar installations designed to detect enemy missiles or aircraft while there is still time to intercept them"
"electromagnetic delay line","a delay line based on the time of propagation of electromagnetic waves"
"electronic fetal monitor","an electronic monitor that monitors fetal heartbeat and the mother's uterine contractions during childbirth"
"electronic foetal monitor","an electronic monitor that monitors fetal heartbeat and the mother's uterine contractions during childbirth"
"explosive detection system","a rapid automatic system to detect plastic explosives in passengers' luggage using X-ray technology and computers"
"explosive trace detection","a system for screening luggage in airports"
"electronic musical instrument","a musical instrument that generates sounds electronically"
"epicyclic gear train","a system of epicyclic gears in which at least one wheel axis itself revolves about another fixed axis"
"equal-area map projection","a map projection in which quadrilaterals formed by meridians and parallels have an area on the map proportional to their area on the globe"
"express luxury liner","a liner equipped for sumptuous living"
"eau de toilette","a perfumed liquid lighter than cologne"
"esprit de corps","the spirit of a group that makes the members want the group to succeed"
"elasticity of shear","the elasticity of a body that has been pulled out of shape by a shearing force"
"extremely low frequency","below 3 kilohertz"
"extremely high frequency","30 to 300 gigahertz"
"external body part","any body part visible externally"
"external auditory canal","either of the passages in the outer ear from the auricle to the tympanic membrane"
"external carotid artery","the branch of the carotid artery that supplies blood to the face and tongue and external parts of the head"
"external maxillary artery","an artery that originates in the external carotid and gives off branches that supply the neck and face"
"external iliac vein","a continuation of the femoral vein"
"external iliac artery","the outer branch of the common iliac artery on either side of the body"
"external jugular vein","formed by the junction of the posterior auricular and the retromandibular veins"
"external nasal vein","one of the veins that drain the external nose and empty into the angular or facial vein"
"eleventh cranial nerve","arises from two sets of roots (cranial and spinal) that unite to form the nerve"
"eighth cranial nerve","a composite sensory nerve supplying the hair cells of the vestibular organ and the hair cells of the cochlea"
"external oblique muscle","a diagonally arranged abdominal muscle on either side of the torso"
"employee savings plan","a plan that allows employees to contribute to an investment pool managed the employer"
"error correction code","a coding system that incorporates extra parity bits in order to detect errors"
"explication de texte","a method of literary criticism that analyzes details of a text in order to reveal its structure and meaning"
"endorsement in blank","an endorsement on commercial paper naming no payee and so payable to the bearer"
"execution of instrument","(law) the completion of a legal instrument (such as a contract or deed) by signing it (and perhaps sealing and delivering it) so that it becomes legally binding and enforceable"
"estimated tax return","return required of a taxpayer whose tax withheld from income does not meet the tax liability for the year"
"electronic information service","(computer science) a database that can be accessed by computers"
"esprit de l'escalier","a witty remark that occurs to you too late"
"earned run average","(baseball) a measure of a pitcher's effectiveness"
"egg en cocotte","egg cooked individually in cream or butter in a small ramekin"
"egg foo yong","omelet containing onions and celery and chopped meat or fish"
"egg fu yung","omelet containing onions and celery and chopped meat or fish"
"eau de vie","strong coarse brandy"
"extended care facility","a medical institution that provides prolonged care (as in cases of prolonged illness or rehabilitation from acute illness)"
"electromotive force series","a serial arrangement of metallic elements or ions according to their electrode potentials determined under specified conditions"
"eastern United States","the region of the United States lying to the north of the Ohio River and to the east of the Mississippi River"
"exotic belly dancer","a woman who performs a solo belly dance"
"executive vice president","a vice president holding executive power"
"editor in chief","a person responsible for the editorial aspects of publication"
"energy of activation","the energy that an atomic system must acquire before a process (such as an emission or reaction) can occur"
"elastic potential energy","potential energy that is stored when a body is deformed (as in a coiled spring)"
"electric dipole moment","the dipole moment in an electric dipole"
"eastern white pine","tall-growing pine of eastern North America"
"eastern red cedar","small juniper found east of Rocky Mountains having a conic crown, brown bark that peels in shreds, and small sharp needles"
"east African cedar","tropical African timber tree with fragrant wood"
"earleaved umbrella tree","small erect deciduous tree with large leaves in coiled formations at branch tips"
"early winter cress","of southwestern Europe"
"early purple orchid","Eurasian orchid with showy pink or purple flowers in a loose spike"
"early coral root","plant having clumps of nearly leafless pale yellowish to greenish stems bearing similarly colored flowers with white lower lips"
"early spider orchid","spring-blooming spider orchid having a flower with yellow or green or pink sepals and a broad brown velvety lip"
"elegant cat's ears","small plant with slender bent stems bearing branched clusters of a few white star-shaped flowers with petals shaped like cat's ears"
"evening trumpet flower","poisonous woody evergreen vine of southeastern United States having fragrant yellow funnel-shaped flowers"
"expressed almond oil","pale yellow fatty oil expressed from sweet or bitter almonds"
"eastern poison oak","poisonous shrub of southeastern United States causing a rash on contact"
"eastern flowering dogwood","deciduous tree"
"evergreen wood fern","North American fern with evergreen fronds"
"evergreen wood fern","North American evergreen fern having pinnate leaves and dense clusters of lance-shaped fronds"
"earning per share","the portion of a company's profit allocated to each outstanding share of common stock"
"estate for life","(law) an estate whose duration is limited to the life of the person holding it"
"exchange traded fund","a mutual fund that is traded on a stock exchange"
"equity credit line","a loan secured by equity value in the borrower's home"
"electronic data processing","automatic data processing by electronic means without the use of tabulating cards or punched tapes"
"eighter from Decatur","the cardinal number that is the sum of seven and one"
"east by north","the compass point that is one point north of due east"
"east by south","the compass point that is one point south of due east"
"ellipsoid of revolution","a shape that is generated by rotating an ellipse around one of its axes"
"erythema nodosum leprosum","an inflammatory complication of leprosy that results in painful skin lesions on the arms and legs and face"
"essential amino acid","an amino acid that is required by animals but that they cannot synthesize"
"eau de Javelle","an aqueous solution of sodium hypochlorite"
"extended time scale","(simulation) the time scale used in data processing when the time-scale factor is greater than one"
"erythrocyte sedimentation rate","the rate at which red blood cells settle out in a tube of blood under standardized conditions"
"explode a bombshell","utter or do something surprising"
"for the moment","temporarily"
"far and away","by a considerable margin"
"face to face","involving close contact"
"for that matter","as far as that is concerned"
"far and wide","over great areas or distances"
"far and near","over great areas or distances"
"first of all","before anything else"
"for a while","for a short time"
"first and last","taking everything together"
"for a song","for a relatively small amount of money"
"for dear life","as though your life was at stake"
"for good measure","in addition (as to close a deal)"
"for any price","under any circumstances"
"for the asking","on the occasion of a request"
"from way back","since long ago"
"for 24 hours","without stopping"
"for each one","to or from every one of two or more (considered individually)"
"from each one","to or from every one of two or more (considered individually)"
"free of charge","without payment"
"from the heart","very sincerely"
"for each person","per person"
"full of life","full of spirit"
"fin de siecle","relating to or characteristic of the end of a century (especially the end of the 19th century)"
"fair to middling","about average"
"flash butt welding","butt welding by creating an electric arc between the two pieces which melts and joins them"
"frank breech delivery","position of a fetus in which the buttocks are present at the maternal pelvic outlet"
"fits and starts","repeated bursts of activity"
"fraud in fact","actual deceit"
"foreign direct investment","a joint venture between a foreign company and a United States company"
"foreign direct investment","investing in United States businesses by foreign citizens (often involves stock ownership of the business)"
"fraud in law","fraud that is presumed from the circumstances although the one who commits it need not have had any evil intent"
"field press censorship","security review of news (including all information or material intended for dissemination to the public) subject to the jurisdiction of the armed forces"
"field of operation","a particular kind of commercial enterprise"
"finding of fact","(law) the findings of a jury on issues of fact submitted to it for decision"
"finding of law","a finding as to the applicability of a rule of law to particular facts"
"false vampire bat","any New or Old World carnivorous bat erroneously thought to suck blood but in fact feeding on insects"
"false saber-toothed tiger","North American cat of the Miocene and Pliocene"
"four-lined plant bug","yellow or orange leaf bug with four black stripes down the back"
"four-lined leaf bug","yellow or orange leaf bug with four black stripes down the back"
