word,definition
"juvenile rheumatoid arthritis","a form of rheumatoid arthritis that affects children"
"jump for joy","to feel extreme happiness or elation"
"kiss of life","an emergency procedure consisting of external cardiac massage and artificial respiration"
"king of beasts","another name for a lion"
"killer T cell","T cell with CD8 receptor that recognizes antigens on the surface of a virus-infected cell and binds to the infected cell and kill it"
"kiss of peace","in the Roman Catholic Church, a greeting signifying Christian love for those assisting at the Eucharist"
"kiss of death","something that is ruinous"
"kola nut tree","a tree bearing large brown nuts containing caffeine native to the tropical rainforests of Africa"
"king nut hickory","hickory of the eastern United States resembling the shagbark but having a much larger nut"
"kei apple bush","a vigorous South African spiny shrub grown for its round yellow juicy edible fruits"
"ketosis-resistant diabetes mellitus","a mild form of diabetes mellitus that develops gradually in adults"
"ketoacidosis-resistant diabetes mellitus","a mild form of diabetes mellitus that develops gradually in adults"
"kettle of fish","a difficult situation"
"kit and caboodle","everything available"
"kit and boodle","everything available"
"kit and kaboodle","everything available"
"kilocycle per second","one thousand periods per second"
"kilometres per hour","the ratio of the distance traveled, in kilometers, to the time spent traveling, in hours"
"kilometers per hour","the ratio of the distance traveled, in kilometers, to the time spent traveling, in hours"
"kick the bucket","to die"
"know what's what","to be well-informed"
"know the score","to be well-informed"
"keep in line","to control others or oneself or influence skillfully, usually to one's advantage"
"keep to oneself","to withhold information from the attention of others"
"keep to oneself","to shun the company of others"
"keep tabs on","to keep a record on or watch attentively"
"keep one's distance","to stay clear of, avoid"
"kick one's heels","wait or pass the time aimlessly or futilely"
"like a shot","without delay or hesitation"
"last not least","in addition to all the foregoing"
"like blue murder","at top speed"
"least of all","especially not"
"little by little","by a short distance"
"little by little","a little bit at a time"
"like the devil","with great speed or effort or intensity"
"like an expert","in an expert manner"
"lying in wait","waiting in concealment"
"lying in wait","the act of concealing yourself and lying in wait to attack by surprise"
"lap of honour","a lap by the winning person or team run to celebrate the victory"
"low level flight","flight at very low altitudes"
"line of work","the principal activity in your life that you do to earn money"
"laser-assisted subepithelial keratomileusis","a refractive surgery procedure that reshapes the cornea"
"laser trabecular surgery","eye surgery that makes many tiny laser burns in an area that will increase the drainage of aqueous humor"
"lying under oath","criminal offense of making false statements under oath"
"labor of love","productive work performed voluntarily without material reward or compensation"
"labour of love","productive work performed voluntarily without material reward or compensation"
"line of business","a particular kind of commercial enterprise"
"line of business","a particular kind of product or merchandise"
"line of duty","all that is normally required in some area of responsibility"
"levy en masse","the act of drafting into military service"
"lymphocytic choriomeningitis virus","the RNA virus that causes lymphocytic choriomeningitis"
"long-billed marsh wren","American wren that inhabits tall reed beds"
"lowland burrowing treefrog","terrestrial burrowing nocturnal frog of grassy terrain and scrub forests having very hard upper surface of head"
"lesser prairie chicken","a smaller prairie chicken of western Texas"
"lesser scaup duck","common scaup of North America"
"little blue heron","small bluish-grey heron of the western hemisphere"
"little brown bat","the small common North American bat"
"little brown myotis","the small common North American bat"
"little black ant","tiny glossy black ant"
"little chief hare","North American pika"
"little spotted skunk","small skunk with a marbled black and white coat"
"lateral line organ","sense organs of fish and amphibians"
"largemouth black bass","a large black bass"
"largemouthed black bass","a large black bass"
"lazy daisy stitch","long chain stitches arranged in flower patterns"
"line of defense","defensive structure consisting of a barrier that can be employed for defense against attack"
"line of defense","any organization whose responsibility it is to defend against something"
"line of defence","defensive structure consisting of a barrier that can be employed for defense against attack"
"line of defence","any organization whose responsibility it is to defend against something"
"local area network","a local computer network for communication between computers"
"light machine gun","a submachine gun not greater than .30 millimeter"
"liquid crystal display","a digital display that uses liquid crystal cells that change reflectivity in an applied electric field"
"liquid metal reactor","a nuclear reactor using liquid metal as a coolant"
"line of products","a particular kind of product or merchandise"
"line of merchandise","a particular kind of product or merchandise"
"lunar excursion module","a spacecraft that carries astronauts from the command module to the surface of the moon and back"
"lysergic acid diethylamide","a powerful hallucinogenic drug manufactured from lysergic acid"
"length of service","duration of service"
"lateral cerebral sulcus","the deepest and most prominent of the cortical fissures"
"ligamentum teres uteri","ligament attached to the uterus on either side in front of and below the opening of the Fallopian tube and passing through the inguinal canal to the labia majora"
"left coronary artery","arises from the left aortic sinus"
"lateral rectus muscle","the ocular muscle whose contraction turns the eyeball outward"
"left gastric artery","a branch of the celiac artery that supplies the lesser curvature of the stomach and the abdominal part of the esophagus"
"left gastric vein","arises from a union of veins from the gastric cardia"
"liquid body substance","the liquid parts of the body"
"long saphenous vein","the longest vein in the body"
"lesser peritoneal cavity","an isolated part of the peritoneal cavity that is dorsal to the stomach"
"lower respiratory tract","the bronchi and lungs"
"lateral geniculate body","a neural structure that serves as a processing station on the way from the retina to the occipital lobe of the cerebral cortex"
"lamina arcus vertebrae","lamina of the vertebral arch"
"lesser rhomboid muscle","rhomboid muscle that draws the scapula toward the vertebral column and slightly upward"
"lust for learning","curiosity that motivates investigation and study"
"line of reasoning","a course of reasoning aimed at demonstrating a truth or falsehood"
"line of thought","a particular way of thinking that is characteristic of some individual or group"
"line of inquiry","an ordering of questions so as to develop a particular argument"
"line of questioning","an ordering of questions so as to develop a particular argument"
"lowest common multiple","the smallest multiple that is exactly divisible by every member of a set of numbers"
"least common multiple","the smallest multiple that is exactly divisible by every member of a set of numbers"
"law of volumes","(physics) the density of an ideal gas at constant pressure varies inversely with the temperature"
"law of areas","a law concerning the speed at which planets travel"
"law of averages","a law affirming that in the long run probabilities will determine performance"
"law of effect","(psychology) the principle that behaviors are selected by their consequences"
"law of gravitation","(physics) the law that states any two bodies attract each other with a force that is directly proportional to the product of their masses and inversely proportional to the square of the distance between them"
"law of thermodynamics","(physics) a law governing the relations between states of energy in a closed system"
"law of segregation","members of a pair of homologous chromosomes separate during the formation of gametes and are distributed to different gametes so that every gamete receives only one member of the pair"
"law of motion","one of three basic laws of classical mechanics"
"law of nature","a generalization that describes recurring facts or events in nature"
"law of Archimedes","(hydrostatics) the apparent loss in weight of a body immersed in a fluid is equal to the weight of the displaced fluid"
"law of parsimony","the principle that entities should not be multiplied needlessly"
"localization of function","(physiology) the principle that specific functions have relatively circumscribed locations in some particular part or organ of the body"
"localisation of function","(physiology) the principle that specific functions have relatively circumscribed locations in some particular part or organ of the body"
"law of closure","a Gestalt principle of organization holding that there is an innate tendency to perceive incomplete objects as complete and to close or fill gaps and to perceive asymmetric stimuli as symmetric"
"law of continuation","a Gestalt principle of organization holding that there is an innate tendency to perceive a line as continuing its established direction"
"law of proximity","a Gestalt principle of organization holding that (other things being equal) objects or events that are near to one another (in space or time) are perceived as belonging together as a unit"
"law of similarity","a Gestalt principle of organization holding that (other things being equal) parts of a stimulus field that are similar to each other tend to be perceived as belonging together as a unit"
"line of poetry","a single line of words in a poem"
"line of verse","a single line of words in a poem"
"letter of marque","a license to a private citizen to seize property of another nation"
"letters of marque","a license to a private citizen to seize property of another nation"
"letters of administration","legal document naming someone to administer an estate when no executor has been named"
"lettre de cachet","a warrant formerly issued by a French king who could warrant imprisonment or death in a signed letter under his seal"
"letter of intent","any letter expressing an intention to take (or forgo) some action"
"line of gab","plausible glib talk (especially useful to a salesperson)"
"loss of consciousness","the occurrence of a loss of the ability to perceive and respond"
"lemon meringue pie","pie containing lemon custard and topped with meringue"
"loaf of bread","a shaped mass of baked bread that is usually sliced before eating"
"loin of lamb","meat from a loin of lamb"
"leg of lamb","lamb leg suitable for roasting"
"light whipping cream","cream that has enough butterfat (30% to 36%) to be whipped"
"line of descent","the descendants of one individual"
"line of descent","the kinship relation between an individual and the individual's progenitors"
"local post office","a local branch where postal services are available'"
"law enforcement agency","an agency responsible for insuring obedience to the laws"
"law of nations","the body of laws governing relations between nations"
"line of march","the arrangement of people in a line for marching"
"line of march","the route along which a column advances"
"line of succession","the order in which individuals are expected to succeed one another in some official position"
"line of battle","a line formed by troops or ships prepared to deliver or receive an attack"
"line of flight","the path along which a freely moving object travels through the air"
"line of sight","an imaginary straight line along which an observer looks"
"line of vision","an imaginary straight line along which an observer looks"
"line of latitude","an imaginary line around the Earth parallel to the equator"
"line of scrimmage","line parallel to the goal lines where football linesmen line up at the start of each play in American football"
"line of longitude","an imaginary great circle on the surface of the earth passing through the north and south poles at right angles to the equator"
"line of fire","the path of a missile discharged from a firearm"
"locus of infection","the specific site in the body where an infection originates"
"liposomal delivery vector","a transducing vector that uses liposomes to carry the gene of interest"
"lieutenant junior grade","an officer holding a commissioned rank in the United States Navy or United States Coast Guard"
"licensed practical nurse","a nurse who has enough training to be licensed by a state to provide routine care for the sick"
"line of force","an imaginary line in a field of force"
"liliid monocot family","family of monocotyledonous plants of the subclass Liliidae"
"liliid monocot genus","genus of monocotyledonous plants comprising mostly herbs having usually petaloid sepals and petals and compound pistils"
"lowland white fir","lofty fir of the Pacific coast of northwestern America having long curving branches and deep green leaves"
"large-leaved cucumber tree","large deciduous shrub or tree of southeastern United States having huge leaves in dense false whorls and large creamy flowers tinged purple toward the base"
"lesser yellow trefoil","clover native to Ireland with yellowish flowers"
"late purple aster","a variety of aster"
"little golden zinnia","subshrub having short leafy stems and numerous small flower heads with nearly round yellow-orange rays"
"lesser butterfly orchid","south European orchid having fragrant greenish-white flowers"
"looking glass tree","large evergreen tree of India and Burma whose leaves are silvery beneath"
"large tooth aspen","aspen with a narrow crown"
"low gallberry holly","an evergreen shrub"
"large white petunia","annual herb having large nocturnally fragrant white flowers"
"leathery grape fern","European fern with leathery and sparsely hairy fronds"
"leatherleaf wood fern","North American fern with evergreen fronds"
"little ebony spleenwort","fern of tropical America: from southern United States to West Indies and Mexico to Brazil"
"little club moss","any of numerous fern allies of the genus Selaginella"
"long beech fern","beech fern of North America and Eurasia"
"letter of credit","a document issued by a bank that guarantees the payment of a customer's draft"
"line of credit","the maximum credit that a customer is allowed"
"luminous flux unit","a measure of luminous flux per unit area"
"luminous intensity unit","a measure of luminous intensity"
"large indefinite quantity","an indefinite quantity that is above the average in size or magnitude"
"large indefinite amount","an indefinite quantity that is above the average in size or magnitude"
"line of fate","a crease on the palm that supposedly represents the fate of its owner"
"line of destiny","a crease on the palm"
"line of Saturn","a crease on the palm"
"line of life","a crease on the palm"
"line of heart","a crease on the palm"
"lower respiratory infection","infection of the lower respiratory tract"
"limb-girdle muscular dystrophy","an autosomal recessive form of muscular dystrophy that appears anywhere from late childhood to middle age"
"lichen ruber planus","an eruption of shiny flat-topped purplish (usually itchy) papules on the wrist and forearms and thighs"
"lateral humeral epicondylitis","painful inflammation of the tendon at the outer border of the elbow resulting from overuse of lower arm muscles (as in twisting of the hand)"
"lap of luxury","in conditions of wealth and comfort"
"liquefied petroleum gas","hydrocarbon gases, usually propane or butane, kept under pressure"
"lath and plaster","a building material consisting of thin strips of wood that provide a foundation for a coat of plaster"
"low-level radioactive waste","(medicine) radioactive waste consisting of objects that have been briefly exposed to radioactivity (as in certain medical tests)"
"leave of absence","the period of time during which you are absent from work or duty"
"lunar time period","there are usually two high and two low tides each day"
"lay waste to","cause extensive destruction or ruin utterly"
"lie in wait","wait in hiding to attack"
"lay hands on","manage with the hands"
"live it up","enjoy oneself"
"let go of","release, as from one's grip"
"look up to","to feel admiration for"
"look down on","regard with contempt"
"lose one's temper","get very angry and fly into a rage"
"lose sight of","be no longer able to see"
"lay eyes on","see with attention"
"line one's pockets","make a lot of money"
"let it go","to not act upon"
"lay to rest","place in a grave or tomb"
"lord it over","act like the master of"
"look out on","be oriented in a certain direction"
"look out over","be oriented in a certain direction"
"live up to","meet the requirements or expectations of"
"more or less","(of quantities) imprecise but fairly close to correct"
"more or less","to a small degree or extent"
"more and more","advancing in amount or intensity"
"month by month","for an indefinite number of months"
"magna cum laude","with high honor"
"modified radical mastectomy","removal of a breast and the pectoralis minor and some lymph nodes in the adjacent armpit"
"metrazol shock therapy","the administration of sufficient Metrazol to induce convulsions and coma"
"metrazol shock treatment","the administration of sufficient Metrazol to induce convulsions and coma"
"magnetic resonance imaging","the use of nuclear magnetic resonance of protons to produce proton density images"
"manual of arms","(military) a prescribed drill in handling a rifle"
"mourning cloak butterfly","of temperate regions"
"meadow jumping mouse","widely distributed in northeastern and central United States and Canada"
"mantled ground squirrel","common black-striped reddish-brown ground squirrel of western North America"
"monoplane flying fish","having only pectoral fins enlarged"
"mercury-in-glass clinical thermometer","a mercury thermometer designed to measure the temperature of the human body"
"magnetic bubble memory","a nonvolatile storage device that holds information in the form of bubbles on a thin film of magnetic silicate"
"magnetic core memory","(computer science) a computer memory consisting of an array of magnetic cores"
"milk of magnesia","purgative consisting of a milky white liquid suspension of magnesium hydroxide"
"missile defense system","naval weaponry providing a defense system"
"missile defence system","naval weaponry providing a defense system"
"mousseline de sole","a gauze-like fabric of silk or rayon"
"microwave diathermy machine","diathermy machine that uses microwave radiation as the source of heat"
"microwave linear accelerator","linear accelerator that uses microwaves"
"mild silver protein","antiseptic consisting of a compound of protein and silver (trade name Argyrol)"
"monoamine oxidase inhibitor","any of a group of antidepressant drugs that inhibit the action of monoamine oxidase in the brain and so allow monoamines to accumulate"
"mise en scene","arrangement of scenery and properties to represent the place where a play or movie is enacted"
"monofocal lens implant","a lens with a single focus that is used after cataract surgery to provide clear distance vision"
"multifocal lens implant","a type of lens implant that contains several rings with a common center and adjusts for near or far vision"
"motor torpedo boat","a small fast unarmored and lightly armed torpedo boat"
"mass rapid transit","an urban public transit system using underground or elevated trains"
"mark of Cain","the mark that God set upon Cain now refers to a person's sinful nature"
"manner of walking","manner of walking"
"margin of safety","the margin required in order to insure safety"
"margin of error","the margin required in order to insure safety"
"magnetic field strength","the amount of magnetic flux in a unit area perpendicular to the direction of magnetic flow"
"magnetic flux density","the amount of magnetic flux in a unit area perpendicular to the direction of magnetic flow"
"marital communications privilege","neither spouse can divulge confidential communications from the other while they were married"
"musculus quadriceps femoris","a muscle of the thigh that extends the leg"
"musculus abductor hallucis","the abductor muscle of the great toe"
"musculus abductor pollicis","the abductor muscle of the thumb"
"musculus adductor brevis","the short adductor muscle of the thigh"
"musculus adductor longus","the long adductor muscle of the thigh"
"musculus adductor magnus","the muscle that adducts and extends the thigh"
"musculus adductor hallucis","the adductor muscle of the great toe"
"musculus articularis cubiti","a small branch of the triceps that inserts into the capsule of the elbow joint"
"musculus articularis genus","the articular muscle of the knee"
"medial rectus muscle","the ocular muscle whose contraction turns the eyeball medially"
"middle cerebral artery","one of two branches of the internal carotid artery"
"middle cerebral vein","either of two cerebral veins"
"middle meningeal artery","branch of the maxillary artery"
"middle thyroid vein","a vein on each side that drains the lateral part of the thyroid and empties into the internal jugular vein"
"middle temporal vein","arises near the eye"
"mononuclear phagocyte system","a widely distributed system of free and fixed macrophages derived from bone marrow"
"medullated nerve fiber","a nerve fiber encased in a sheath of myelin"
"myelinated nerve fiber","a nerve fiber encased in a sheath of myelin"
"motor end plate","the flattened end of a motor neuron that transmits neural impulses to a muscle"
"medial geniculate body","a neural structure that serves as the last of a series of processing centers along the auditory pathway from the cochlea to the temporal lobe of the cerebral cortex"
"male reproductive system","the reproductive system of males"
"musculus serratus anterior","muscles that rotate the scapula and elevate the rib cage"
"musculus serratus posterior","skeletal muscle that draws the rib cage backward and downward"
"male reproductive gland","the reproductive organs of a man"
"musculus biceps brachii","a muscle that flexes and supinates the forearm"
"musculus triceps brachii","the skeletal muscle having three origins that extends the forearm when it contracts"
"musculus pectoralis major","a skeletal muscle that adducts and rotates the arm"
"musculus sphincter ani","the sphincter muscle of the anus"
"musculus pectoralis minor","a skeletal muscle that draws down the scapula or raises the ribs"
"musculus sphincter urethrae","a striated sphincter muscle that constricts the urethra"
"musculus sphincter vesicae","the sphincter muscle of the urinary bladder"
"musculus sphincter pupillae","a ring of smooth muscle surrounding the iris"
"musculus sphincter pylori","the sphincter muscle of the pylorus that separates the stomach from the duodenum"
"musculus rhomboideus major","rhomboid muscle that draws the scapula toward the spinal column"
"musculus rhomboideus minor","rhomboid muscle that draws the scapula toward the vertebral column and slightly upward"
"musculus transversalis abdominis","a flat muscle with transverse fibers that forms the anterior and lateral walls of the abdominal cavity"
"musculus biceps femoris","the biceps muscle of the thigh"
"musculus teres major","teres muscle that moves the arm and rotates it medially"
"musculus teres minor","teres muscle that adducts the arm and rotates it laterally"
"method of choice","the best method to achieve a desired result"
"meat and potatoes","the fundamental part"
"matter of fact","a matter that is an actual fact or is demonstrable as a fact"
"matter of fact","a disputed factual contention that is generally left for a jury to decide"
"method of fluxions","the part of calculus that deals with the variation of a function with respect to changes in the independent variable (or variables) by means of the concepts of derivative and differential"
"multiple correlation coefficient","an estimate of the combined influence of two or more variables on the observed (dependent) variable"
"magnetic storage medium","any storage medium in which different patterns of magnetization are used to represent stored bits or bytes of information"
"main entry word","the form of a word that heads a lexical entry and is alphabetized in a dictionary"
"major form class","any of the major parts of speech of traditional grammar"
"modal auxiliary verb","an auxiliary verb (such as `can' or `will') that is used to express modality"
"machine readable dictionary","a machine-readable version of a standard dictionary"
"matter of law","a disputed legal contention that is generally left for a judge to decide"
"major diatonic scale","a diatonic scale with notes separated by whole tones except for the 3rd and 4th and 7th and 8th"
"minor diatonic scale","a diatonic scale with notes separated by whole tones except for the 2nd and 3rd and 5th and 6th"
"musical time signature","a musical notation indicating the number of beats to a measure and kind of note that takes a beat"
"manner of speaking","your characteristic style or manner of expressing yourself orally"
"matter of course","an inevitable ending"
"manna from heaven","a sudden happening that brings good fortune (as a sudden opportunity to make money)"
"manna from heaven","(Old Testament) food that God gave the Israelites during the Exodus"
"mock turtle soup","soup made from a calf's head or other meat in imitation of green turtle soup"
"marchand de vin","brown sauce with mushrooms and red wine or Madeira"
"mushroom wine sauce","brown sauce with mushrooms and red wine or Madeira"
